name_description,true_label,zeroshot_pred,fewshot_pred
"Sonata 1141YM22 Analog Watch  - For Men Sonata 1141YM22 Analog Watch  - For Men - Buy Sonata 1141YM22 Analog Watch  - For Men  1141YM22 Online at Rs.949 in India Only at Flipkart.com. Round Dial, Water Resistant, Golden Strap, Deployment Clasp - Great Discounts, Only Genuine Products, 30 Day Replacement Guarantee, Free Shipping. Cash On Delivery!",Watches,Watches,Watches
The Art Box Floral Single Dohar Multicolor Buy The Art Box Floral Single Dohar Multicolor at Rs. 699 at Flipkart.com. Only Genuine Products. Free Shipping. Cash On Delivery!,Home Furnishing,Home Decor & Festive Needs,Home Decor & Festive Needs
"Rishan Printed Baby Boy's V-neck T-Shirt Specifications of Rishan Printed Baby Boy's V-neck T-Shirt T-shirt Details Sleeve Full Sleeve Number of Contents in Sales Package Pack of 1 Fabric Cotton Type V-neck Fit Regular General Details Pattern Printed Occasion Casual Ideal For Baby Boy's In the Box 1 T Shirt Additional Details Style Code RISHAK-FSP-14 Fabric Care do not wring,do not use hot water,do not restitch",Baby Care,Baby Care,Baby Care
"PRINT SHAPES Red bull Laptop Skin with Mouse pad Combo Set Key Features of PRINT SHAPES Red bull Laptop Skin with Mouse pad Combo Set Glue Free Removal 15.6 inches Laptop skin Easy to Apply & Scratch Resistant Lamination,PRINT SHAPES Red bull Laptop Skin with Mouse pad Combo Set (Multicolor) Price: Rs. 329 Print Shapes Laptop skin made on High Quality vinyl sheet is compatible with laptops screen sizes ranging from 14.1 inches to 15.6 inches. Trimning of the skin would be required as per your laptop size. The skins are easy to install & remove without leaving any gum or residue,Specifications of PRINT SHAPES Red bull Laptop Skin with Mouse pad Combo Set (Multicolor) General Brand PRINT SHAPES Model Name Red bull Laptop Skin with Mouse pad Suitable_for All types of Laptop Color Multicolor Warranty Warranty Summary No Warranty In the Box Number of Contents in Sales Package Pack of 2",Computers,Computers,Computers
My NewBorn Solid Single Wrapper Assorted Muti Colors Buy My NewBorn Solid Single Wrapper Assorted Muti Colors at Rs. 550 at Flipkart.com. Only Genuine Products. Free Shipping. Cash On Delivery!,Baby Care,Baby Care,Baby Care
Apple AirPort Express Base Station Wireless Router Buy Apple AirPort Express Base Station Wireless Router only for Rs. 6800 from Flipkart.com. Only Genuine Products. 30 Day Replacement Guarantee. Free Shipping. Cash On Delivery!,Computers,Computers,Computers
"Pioneer Pragati Floral Single Duvet Orange Pioneer Pragati Floral Single Duvet Orange (1 Duvet)
                         Price: Rs. 1,099
				
			World famous Jaipuri Pure Cotton Single Bed Comforter (also populary called as Dohar) in traditional Sanganeri Gold Print of Rajasthan. The Comforter is a 3-layered cover with fluffy middle layer of High Grade Flannel sheet between two layers of cotton fabric. Being light weight, these are ideal during travelling.

Product Usage:
Envelop yourself in the folds of our unique decorative Comforter and drift off to exotic lands. Ensconced within the folds of this buttery soft cotton comforter your sleep will be sweet and deep, whether you choose to spend your nights cocooned in warm cozy slumber or you choose to indulge in a restful afternoon siesta.

Specifications:

Product Dimensions: LxB: 90x60 inches
Item Type: Single Bed Comforter
Color: Multicolor
Material: Cloth
Specialty: Gold Print Floral Design Quilt.
Filling: High Grade Flannel sheet
Fabric GSM: 170
Wash care:
Dryclean only

Disclaimer:
The item being handmade, the fine design, pattern and color tone of the product may vary slightly from that shown in the image. However, there would not be any compromise in quality.

Return Policy:
No Questions Asked 7 days Return/ Replacement, if you are not satisfied with the product.

Brand:
Pioneer Pragati
World famous Jaipuri Pure Cotton Single Bed Comforter (also populary called as Dohar) in traditional Sanganeri Gold Print of Rajasthan. The Comforter is a 3-layered cover with fluffy middle layer of High Grade Flannel sheet between two layers of cotton fabric. Being light weight, these are ideal during travelling.

Product Usage:
Envelop yourself in the folds of our unique decorative Comforter and drift off to exotic lands. Ensconced within the folds of this buttery soft cotton comforter your sleep will be sweet and deep, whether you choose to spend your nights cocooned in warm cozy slumber or you choose to indulge in a restful afternoon siesta.

Specifications:

Product Dimensions: LxB: 90x60 inches
Item Type: Single Bed Comforter
Color: Multicolor
Material: Cloth
Specialty: Gold Print Floral Design Quilt.
Filling: High Grade Flannel sheet
Fabric GSM: 170
Wash care:
Dryclean only

Disclaimer:
The item being handmade, the fine design, pattern and color tone of the product may vary slightly from that shown in the image. However, there would not be any compromise in quality.

Return Policy:
No Questions Asked 7 days Return/ Replacement, if you are not satisfied with the product.

Brand:
Pioneer Pragati",Home Furnishing,Home Furnishing,Home Furnishing
Zyxel PLA-4205 Buy Zyxel PLA-4205 only for Rs. 8100 from Flipkart.com. Only Genuine Products. 30 Day Replacement Guarantee. Free Shipping. Cash On Delivery!,Computers,Computers,Computers
"HomeEdge Solid Wood King Bed Key Features of HomeEdge Solid Wood King Bed King Bed 72x78 Mattress Size 1 King Bed Natural Polish,HomeEdge Solid Wood King Bed (Finish Color -  Natural) Price: Rs. 18,799 Made to Order SolidWood Bed made by the finest artisans from Rajasthan. Bed is made to perfection. These Beds are handicraft products which are made to order by the manufacturer. Please make sure that this bed is ordered once you are aware of the entire product. Mattress Dimension of a Queen Size Bed will be 60inch x 78inch and Mattress Dimension of a King Bed will be 72inch x 78inch. Kindly check the mattress size before you order the bed. Also, the polish might have a slight variation as these are wooden products and grains are not uniform. due to grains the polish might look light or dark in some portions. All the Wooden products are termite treated and has gone through a high level quality check before being packed.,Specifications of HomeEdge Solid Wood King Bed (Finish Color -  Natural) Installation & Demo Installation & Demo Details Installation and demo for this product is done free of cost as part of this purchase. Our service partner will visit your location within 72 business hours from the delivery of the product In The Box 1 King Bed General Brand HomeEdge Delivery Condition Knock Down Storage Included No Style Contemporary & Modern Bed Size King Upholstery Included No Upholstery Type NA Suitable For Bedroom, Kids Room Model Number HE_BED_King_04 With Mattress No Bed Type Standard Finish Type Matte Care Instructions Wipe clean with a cloth, No Water, Keep away from direct sunlight Important Note Cancellation NOT allowed for this product after 24 hrs of order booking. Warranty Covered in Warranty Limited to Manufacturing Defects Only Service Type On-site Service, Customer needs to call the nearby Authorized Service Center, service engineer will come to the site to get the product repaired or inspected. Warranty Summary 1 Year Company Domestic Warranty Not Covered in Warranty Normal Wear and Tear is not a part of the warranty Dimensions Weight 80 kg Floor Clearance 317.5 mm Height 760 mm Width 1900 mm Depth 2060 mm Disclaimer - The color of the product may vary slightly compared to the picture displayed on your screen. This is due to lighting, pixel quality and color settings - Please check the product's dimensions to ensure the product will fit in the desired location. Also, check if the product will fit through...View More - The color of the product may vary slightly compared to the picture displayed on your screen. This is due to lighting, pixel quality and color settings - Please check the product's dimensions to ensure the product will fit in the desired location. Also, check if the product will fit through the entrance(s) and door(s) of the premises - Please expect an unevenness of up to 5 mm in the product due to differences in surfaces and floor levels - Flipkart, or the Seller delivering the product, will not take up any type of civil work, such as drilling holes in the wall to mount the product. The product will only be assembled in case carpentry assembly is required - In case the product appears to lack shine, wiping the surface with a cloth will help clear the surface of dust particles Material & Color Upholstery Color NA Primary Color Brown Primary Material Solid Wood Secondary Material Subtype NA Secondary Material NA Finish Color Natural Primary Material Subtype Rosewood (Sheesham) Additional Features Origin of Manufacture Domestic",Beauty and Personal Care,Home Furnishing,Home Furnishing
"Hako 85W Magsafe Laptop Charger For APPLE MacBook Pro 17 MA897LLA 85 Adapter Key Features of Hako 85W Magsafe Laptop Charger For APPLE MacBook Pro 17 MA897LLA 85 Adapter Designed For: APPLE MacBook Pro 17"" MB133LL/A MAGSAFE,Hako 85W Magsafe Laptop Charger For APPLE MacBook Pro 17 MA897LLA 85 Adapter Price: Rs. 1,849 Hako laptop adapters come with high quality certification and are compatible with respective brands, all adapters are equipped with protection circuit to protect the laptop all adapters come with 1year warranty.,Specifications of Hako 85W Magsafe Laptop Charger For APPLE MacBook Pro 17 MA897LLA 85 Adapter General Brand Hako Designed For APPLE MacBook Pro 17"" MB133LL/A MAGSAFE Sales Package 1 Laptop Adapter Model Name APPLE MacBook Pro 17"" MB133LL/A MAGSAFE Model Id 85W Magsafe Laptop Charger For APPLE MacBook Pro 17 MA897LLA Power Power Consumption (W) 85 W Warranty Covered in Warranty Manufacturing Defects Only Warranty Summary 1 Year Warranty Warranty Service Type To Claim a Warranty Customer needs to contact seller.. Then he will be guided to the nearest service center.. If the service center is not available in in his area then he needs to courier the product to seller and we will replace the product and send via courier Not Covered in Warranty Any Physcal Damage will not be covered under warranty",Computers,Computers,Computers
Aero Care Blue 4 Lady Combo Set Flipkart.com: Buy Aero Care Blue 4 Lady Combo Set online only for Rs. 165 from Flipkart.com. Only Genuine Products. 30 Day Replacement Guarantee. Free Shipping. Cash On Delivery!,Beauty and Personal Care,Home Furnishing,Home Furnishing
"HMT Sonata Gold Plated Watch For Men Sonata Analog Watch  - For Men HMT Sonata Gold Plated Watch For Men Sonata Analog Watch  - For Men - Buy HMT Sonata Gold Plated Watch For Men Sonata Analog Watch  - For Men  Sonata Gold Plated Watch For Men Online at Rs.899 in India Only at Flipkart.com. - Great Discounts, Only Genuine Products, 30 Day Replacement Guarantee, Free Shipping. Cash On Delivery!",Watches,Watches,Watches
KLIQVIK SIX PORT USB HUB FOR ANDROID MOBILES TR-250 USB USB Hub Buy KLIQVIK SIX PORT USB HUB FOR ANDROID MOBILES TR-250 USB USB Hub for Rs.1099 online. KLIQVIK SIX PORT USB HUB FOR ANDROID MOBILES TR-250 USB USB Hub at best prices with FREE shipping & cash on delivery. Only Genuine Products. 30 Day Replacement Guarantee.,Computers,Computers,Computers
"Prithish Believe In Yourself Double Color Ceramic Mug Prithish Believe In Yourself Double Color Ceramic Mug (330 ml)
                         Price: Rs. 225
				
			""Get Talking With Your Coffee! Our Wide Selection Of Cute And Catchy Designs Means You'Re Sure To Find The Quote That Says What It Is, The Way It Is. And If These Mugs Bring On The Smiles, Don'T Forget To Share Them. Mugs Like These Make Great Gifts! Each Mug Is Beautifully Designed With Quality Ink And Attractive Graphics, Perfect For All Around Enjoyment."" ""Express Yourself! Our Distinctive Coffee Mugs Give You The Freedom To Broadcast Your Own Special Message, From Holiday Cheer To Your Love Of Cupcakes. These Affordable Mugs Are Also Perfect For Gifting, So You Can Show Others Just How Well You Know Them. Break Out The Mugs, And Bring On The Laughs! Happy Sipping!
""Get Talking With Your Coffee! Our Wide Selection Of Cute And Catchy Designs Means You'Re Sure To Find The Quote That Says What It Is, The Way It Is. And If These Mugs Bring On The Smiles, Don'T Forget To Share Them. Mugs Like These Make Great Gifts! Each Mug Is Beautifully Designed With Quality Ink And Attractive Graphics, Perfect For All Around Enjoyment."" ""Express Yourself! Our Distinctive Coffee Mugs Give You The Freedom To Broadcast Your Own Special Message, From Holiday Cheer To Your Love Of Cupcakes. These Affordable Mugs Are Also Perfect For Gifting, So You Can Show Others Just How Well You Know Them. Break Out The Mugs, And Bring On The Laughs! Happy Sipping!",Kitchen & Dining,Home Furnishing,Home Furnishing
"Bourne Supermacy Canvas Art Key Features of Bourne Supermacy Canvas Art Unique and Uber design High Grade 300 GSM Canvas Poster Bright Detailed Printing Standard 12"" x 18"" size Comes in rolled form in a Poster Tube,Bourne Supermacy Canvas Art (18 inch X 12 inch, Rolled) Price: Rs. 999 Bourne Supermacy Canvas poster from Urban Monk accomplishes its task of reflecting your passion about the thing and solely provides an elegant touch to your home or your work place. Understanding and providing the urban folks with the designs ranging from music ,movies, tv, shows, cricket, football, NBA, NFL, minimal, funny. abstract art etc posters is our sole purpose.Bourne Supermacy 12x18 inches poster is made of high grade 300gsm Canvas paper ,then printed using ultra violet discharge printing for the richness of colours and details. We have made sure that this canvas art provides you a sense of satisfaction. It comes in a rigid poster tube to prevent carriage damage. Margins are left on the sides for framing.,Specifications of Bourne Supermacy Canvas Art (18 inch X 12 inch, Rolled) Warranty Warrenty is limited to manufacturing defects only. Dimensions Paper Depth 285 gsm Weight 100 g Height 18 inch Width 12 inch Poster Details Shape Rectangle Category Nature, Educational, Sports Paper Finish Matte Paper Type Canvas Art Sub-Category Thrillers, Bollywood, Music & Musical Instruments Color Poster Yes In the Box Number of Contents in Sales Package 1 Sales Package 1 Rolled Poster",Home Decor & Festive Needs,Home Decor & Festive Needs,Home Decor & Festive Needs
Rajasthan Crafts Abstract Single Quilts & Comforters Green Buy Rajasthan Crafts Abstract Single Quilts & Comforters Green at Rs. 840 at Flipkart.com. Only Genuine Products. Free Shipping. Cash On Delivery!,Home Furnishing,Home Furnishing,Home Decor & Festive Needs
AsiaCraft Goddess of Wealth Laxmi Brass Statue Showpiece  -  7.62 cm Buy AsiaCraft Goddess of Wealth Laxmi Brass Statue Showpiece  -  7.62 cm for Rs.350 online. AsiaCraft Goddess of Wealth Laxmi Brass Statue Showpiece  -  7.62 cm at best prices with FREE shipping & cash on delivery. Only Genuine Products. 30 Day Replacement Guarantee.,Home Decor & Festive Needs,Home Decor & Festive Needs,Home Decor & Festive Needs
"Sapatos Plain Single Duvet Blue Sapatos Plain Single Duvet Blue (1 Piece Brown Single Duvet)
                         Price: Rs. 1,499
				
			Add spunk to your home decor with this beautifully designed Duvet from Sapatos. Crafted to provide utmost comfort, this exquisite Quilt will ensure that you look forward to crash into bed after a tiring day.
Add spunk to your home decor with this beautifully designed Duvet from Sapatos. Crafted to provide utmost comfort, this exquisite Quilt will ensure that you look forward to crash into bed after a tiring day.",Home Furnishing,Home Furnishing,Home Furnishing
"Techone+ Portable SE122103-WHITE USB Led Light Techone+ Portable SE122103-WHITE USB Led Light (White)
                         Price: Rs. 449
				
			Usable with Power Bank, Laptop, USB Port Adaptor, USB Multi Pin Board & USB Port Device.
Usable with Power Bank, Laptop, USB Port Adaptor, USB Multi Pin Board & USB Port Device.",Computers,Computers,Computers
"Nutcase Sticker Wrap Design - Gummy Bears 800 ml Bottle Nutcase Sticker Wrap Design - Gummy Bears 800 ml Bottle (Pack of 1, Multicolor)
                         Price: Rs. 399
				
			Nutcase brings you designer water bottle . Nutcase Bottles reflect your style, your attitude. This aluminium water bottle comes with a harness hook , waterproof sticker wrap and a fresh , quirky playful design .
Nutcase brings you designer water bottle . Nutcase Bottles reflect your style, your attitude. This aluminium water bottle comes with a harness hook , waterproof sticker wrap and a fresh , quirky playful design .",Kitchen & Dining,Home Decor & Festive Needs,Home Decor & Festive Needs
"Miracle Retail Bonsai Wild Plant Artificial Plant  with Pot Key Features of Miracle Retail Bonsai Wild Plant Artificial Plant  with Pot Premium quality soft plastic Artificial Bonsai plant with high quality Wooden pot Can be used for indoor and outdoor purpose Ideal for Home décor & Garden décor Ideal for Side corners Ideal for Centre table,Miracle Retail Bonsai Wild Plant Artificial Plant  with Pot (32 cm, Yellow) Price: Rs. 599 Let Natural Hues Refresh Your Interior Once You Bring This Artificial Bonsai Plant With Wooden pot from The House Of Miracle Retail. Ideal For Beautifying The Side Table, Centre Table And Dining Table, This Decorative Item Requires Minimum Maintenance And Care. Made From Premium Quality Plastic, The Artificial Bonsai Plant Is Completely Non Toxic And Environment Friendly. On The Other Hand, The Base Is Extremely Sturdy Yet Lightweight. Those Who Want To Brighten Up Their Living Space Without Any Dirt Or Mud, Must Opt For This Artificial Bonsai Plant With Wooden Pot. To add colour to your interior landscape, order this Artificial Bonsai Plant from Miracle Retail. It instantly brightens up the place wherever you keep it. It needs minimal care. It Will Make A Great Gifting Option For Friends And Relatives As Well.,Specifications of Miracle Retail Bonsai Wild Plant Artificial Plant  with Pot (32 cm, Yellow) General Brand Miracle Retail Model Number BNSI/03 Stem Material Plastic Bonsai Yes Type Wild Plant Plant Material Plastic Color Yellow Pot Features Pot Material Wood Pot Color Brown Pot Included Yes Pot Size Medium Dimensions Pot Width 10 cm Weight 400 g Total Height 32 cm Pot Height 14 cm Total Width 16 cm Additional Features Suitable For Home Decor, Garden Decor, Office Decor Number of Branches 1 In the Box Sales Package 1 Premium Bonsai Artificial Plant With Wooden Pot Pack of 1",Home Decor & Festive Needs,Home Decor & Festive Needs,Home Decor & Festive Needs
"Adino ADF04 Analog Watch  - For Girls Specifications of Adino ADF04 Analog Watch  - For Girls General Type Analog Style Code ADF04 Ideal For Girls Occasion Party-Wedding Warranty 3 Month Body Features Dial Shape Round Strap Color Steel Dial Color Black, Pink, Green, Purpal",Watches,Watches,Watches
Aero Care La Royal Orange & Ice Combo Set Flipkart.com: Buy Aero Care La Royal Orange & Ice Combo Set online only for Rs. 165 from Flipkart.com. Only Genuine Products. 30 Day Replacement Guarantee. Free Shipping. Cash On Delivery!,Beauty and Personal Care,Home Furnishing,Home Furnishing
"Buyer's Beach BB349 Buyer's Beach BB349 (Brown) Price: Rs. 449 Stylish In Every Discernment, These Multicolor Cups Will Procure An Individual Boundless Compliments From Your Companions. Likewise, This Specific Artistic Altered Can Be Light And Convenient, Chips Resistant And Additionally Dishwasher Danger Free.,Specifications of Buyer's Beach BB349 (Brown) General Brand Buyer's Beach Model Number BB349 Type Tea Dishwasher Safe Yes Material Ceramic Color Brown In the box Sales Package 4 Cups",Kitchen & Dining,Home Decor & Festive Needs,Kitchen & Dining
"Shoppingtara Paper Mache 3 Piece Elephant Home Decor Gift Showpiece  -  4 cm Shoppingtara Paper Mache 3 Piece Elephant Home Decor Gift Showpiece  -  4 cm (Paper Mache, Multicolor)
                         Price: Rs. 489
				
			This handcrafted elephant is a set of 3 piece elephants made of Chinese Paper Mache art. They have been decorated with enamel paint and lacquer polish. The size of the elephants is in increasing order of 2.5 inch, 3 inch and 3.5 inch. It is an exclusive show piece for your drawing room; sure to be admired by your guests.
This handcrafted elephant is a set of 3 piece elephants made of Chinese Paper Mache art. They have been decorated with enamel paint and lacquer polish. The size of the elephants is in increasing order of 2.5 inch, 3 inch and 3.5 inch. It is an exclusive show piece for your drawing room; sure to be admired by your guests.",Home Decor & Festive Needs,Home Decor & Festive Needs,Home Decor & Festive Needs
"Perucci PC-222 Decker Analog Watch  - For Men Perucci PC-222 Decker Analog Watch  - For Men - Buy Perucci PC-222 Decker Analog Watch  - For Men  PC-222 Online at Rs.290 in India Only at Flipkart.com. Beautifull Watches, Comfortable Watches, Fancy Watche, Stylish Watches - Great Discounts, Only Genuine Products, 30 Day Replacement Guarantee, Free Shipping. Cash On Delivery!",Watches,Watches,Watches
"Layer'r Shot Compact Impact ,Explode And Turbo Body Spray (Pack Of 3) Combo Set Flipkart.com: Buy Layer'r Shot Compact Impact ,Explode And Turbo Body Spray (Pack Of 3) Combo Set online only for Rs. 355 from Flipkart.com. Only Genuine Products. 30 Day Replacement Guarantee. Free Shipping. Cash On Delivery!",Beauty and Personal Care,Beauty and Personal Care,Beauty and Personal Care
Moonleaf Geometric Cushions Cover Buy Moonleaf Geometric Cushions Cover at Rs. 199 at Flipkart.com. Only Genuine Products. Free Shipping. Cash On Delivery!,Home Furnishing,Home Furnishing,Home Furnishing
"Sparklings Cotton Checkered Double Bedsheet Key Features of Sparklings Cotton Checkered Double Bedsheet Best Fit For:-Large Size Double Bed(6.5 ft X 6 ft) Thread Count:160 TC Package Content:1 Double Bedsheet With 2 Pillow Cover,Sparklings Cotton Checkered Double Bedsheet (double bedsheet with pillow covers, Multicolor) Price: Rs. 549 There are days when you don’t want to socialise, and just curl up on your bed, and read, or watch your favourite TV show. For those days, you can jazz up your bedroom décor, by spreading this double bedsheet from SPARKLINGS to pep up your mood. Print that you will Love The blend of abstract and floral prints gives this bedsheet an appealing look. Cotton You wouldn’t want to leave your bedroom anymore, as the bedsheet and two pillow covers are made of cotton to help you relax your body and mind as soon as you hit the bed.,Specifications of Sparklings Cotton Checkered Double Bedsheet (double bedsheet with pillow covers, Multicolor) General Brand Sparklings Machine Washable Yes Type Flat Material Cotton Model Name BDOA510SPK Ideal For Boys & Girls Model ID BDOA510SPK Color Multicolor Size Double Fabric Care First few wash separately, Dark colors to be wash separately, Cold machine wash, Do not use strong Detergent, Do not Bleach, Do not Tumble Dry, Do not Iron on Prints, Do not soak for long time, Dry In Shade. Dimensions Flat Sheet Width 89 inch / 228 cm Fitted Sheet Width 0 cm Pillow Cover Width 17 inch / 45 cm Pillow Cover Length 27 inch / 69 cm Weight 450 g Fitted Sheet Depth 0 cm Fitted Sheet Length 0 cm Flat Sheet Depth 3 cm Flat Sheet Length 89 inch / 228 cm In the Box Number of Contents in Sales Package 1 Sales Package double bedsheet with pillow covers Additional Features Product color may vary due to photogenic effect",Baby Care,Home Furnishing,Home Furnishing
"Prithish Never Ever Give Up Ceramic Mug Prithish Never Ever Give Up Ceramic Mug (330 ml)
                         Price: Rs. 175
				
			""Get talking with your coffee! Our wide selection of cute and catchy designs means you're sure to find the quote that says what it is, the way it is. And if these mugs bring on the smiles, don't forget to share them. Mugs like these make great gifts! Each mug is beautifully designed with quality ink and attractive graphics, perfect for all around enjoyment."" ""Express yourself! Our distinctive coffee mugs give you the freedom to broadcast your own special message, from holiday cheer to your love of cupcakes. These affordable mugs are also perfect for gifting, so you can show others just how well you know them. Break out the mugs, and bring on the laughs! Happy sipping!
""Get talking with your coffee! Our wide selection of cute and catchy designs means you're sure to find the quote that says what it is, the way it is. And if these mugs bring on the smiles, don't forget to share them. Mugs like these make great gifts! Each mug is beautifully designed with quality ink and attractive graphics, perfect for all around enjoyment."" ""Express yourself! Our distinctive coffee mugs give you the freedom to broadcast your own special message, from holiday cheer to your love of cupcakes. These affordable mugs are also perfect for gifting, so you can show others just how well you know them. Break out the mugs, and bring on the laughs! Happy sipping!",Kitchen & Dining,Home Furnishing,Home Furnishing
Baby Bucket Cartoon Single Blanket blue Buy Baby Bucket Cartoon Single Blanket blue at Rs. 1395 at Flipkart.com. Only Genuine Products. Free Shipping. Cash On Delivery!,Home Furnishing,Baby Care,Baby Care
"Fighter FIGH_008 Digital Watch  - For Couple Fighter FIGH_008 Digital Watch  - For Couple - Buy Fighter FIGH_008 Digital Watch  - For Couple  FIGH_008 Online at Rs.225 in India Only at Flipkart.com. - Great Discounts, Only Genuine Products, 30 Day Replacement Guarantee, Free Shipping. Cash On Delivery!",Watches,Watches,Watches
